{
  "$schema": "../../../../docs/schemas/runtime-verdict.schema.json",
  "schemaVersion": 1,
  "scenarioId": "reborn.zexpedition03.raynor-smoke",
  "runId": "not-run",
  "status": "inconclusive",
  "criteria": [
    { "id": "runtime-ready", "status": "not-observed", "evidence": [] },
    { "id": "raynor-production", "status": "not-observed", "evidence": [] },
    { "id": "mission-flow", "status": "not-observed", "evidence": [] }
  ],
  "evidence": [],
  "notes": ["Contract example only; project runtime validation must replace this with observed evidence."]
}
